{
  "report_type": "preflight",
  "created_at": "2026-04-24T03:10:00+00:00",
  "status": "pass",
  "checks": [
    {
      "name": "taskboard",
      "status": "pass",
      "schema": "knot/automation/schemas/taskboard.schema.json",
      "input": "knot/runtime/taskboard.json",
      "message": "VALID: knot/runtime/taskboard.json"
    },
    {
      "name": "project-spec",
      "status": "pass",
      "schema": "knot/automation/schemas/project-spec.schema.json",
      "input": "knot/runtime/project-spec.json",
      "message": "VALID: knot/runtime/project-spec.json"
    }
  ],
  "metadata": {
    "runner": "run_preflight.py"
  },
  "extensions": {}
}
